Plant Type,Key,Botanical Name,Common Name,Height (ft),Spread (ft),Bloom Color,Bloom Time,Sun,Water,AGCP Regional Status,USDA Hardiness Zone,Attracts,Tolerates,Soil Description,Condition Comments,MaintenanceLevel,Native Habitats,Culture,Uses,UseXYZ,WFMaintenance,Problems,Link: Missouri Botanical Garden,Link: Wildflower.org,Link: Pleasantrunnursery.com,Link: Newmoonnursery.com,Link: Pinelandsnursery.com,Rev
"Herbaceous, Perennial",AH,Amsonia hubrichtii,THREADLEAF BLUE STAR,2 - 3,2 - 3,Blue,"Apr, May","Full Sun, Part Shade",Medium,,Zone 5 to 8,Butterflies,"Deer, Clay Soil","Grow in medium, well-drained soil in full sun to part shade.","Best fall color occurs in full sun, but flowers last longer with some afternoon shade. To much shade causes stems to flop over. Cut back to 6 inches after flowering to shape plants into a mound.",Low,,"Easily grown in average, medium, well-drained soil in full sun to part shade. Tolerant of a wide range of soil types including clayey soils. Best fall foliage color usually occurs in full sun, but flowers generally last longer if given some afternoon shade in hot sun areas. Stems tend to open up and flop in too much shade, however. Consider cutting back the stems by about 6"" after flowering to help keep stems upright and to shape plants into a nice foliage mound.","Borders, rock gardens, cottage gardens, open woodland areas, rain gardens. Best when massed. Flowers can be used in fresh cut arrangements.","Use Ornamental: Mass plants in in borders, rock gardens and open woodlands.",,"No serious insect or disease problems. Plants may flop, particularly if not cut back after flowering. Deer tend to avoid this plant.",https://www.missouribotanicalgarden.org/PlantFinder/PlantFinderDetails.aspx?kempercode=w810,https://www.wildflower.org/plants/result.php?id_plant=AMHU,https://www.pleasantrunnursery.com/plant-name/Amsonia-hubrichtii,NA,https://www.pinelandsnursery.com/amsonia-hubrichtii,20250611_AN
"Herbaceous, Perennial",AT,Amsonia tabernaemontana,"BLUE STAR, BLUE DOGBANE",2 - 3,2 - 3,,,"Full Sun, Part Shade",Medium,FACW,Zone 3 to 9,,"Deer, Drought, Clay Soil","Wet to moist, sandy soils.","This species should be cut back after flowering. Blue star has naturalized northeast as far as Massachusetts. A similar species, A. illustris, occurs inland from MO & KS to TX.",Low,"Wet, sandy sites in thin woods & on plains.","Easily grown in average, medium, well-drained soil in full sun to part shade. Prefers moist, loamy soils. Tolerates some drought. When grown in full sun, plants often require no pruning or staking. When grown in some shade and/or in rich soils, however, plants tend to become more open and floppy and often require staking or pruning. For a neater appearance, particularly for shade-grown plants, consider cutting back stems by 1/2 to 1/3 after flowering to promote bushy growth and, if desired, a more rounded foliage mound.","Borders, rock gardens, cottage gardens, open woodland areas, rain gardens. Best when massed. Flowers can be used in fresh cut arrangements.",,,No serious insect or disease problems. May require staking to avoid flopping in overly rich soils or shady conditions. Rust may occur. Deer tend to avoid this plant.,https://www.missouribotanicalgarden.org/PlantFinder/PlantFinderDetails.aspx?taxonid=276088&isprofile=1&gen=Amsonia,https://www.wildflower.org/plants/result.php?id_plant=amta2,NA,https://newmoonnursery.com/nursery-plants/amsonia-tabernaemontana/,NA,20250611_AN
"Herbaceous, Perennial",ATM,Amsonia tabernaemontana 'Montana',BLUE STAR,1 - 1.5,0.75 - 1,,,"Full Sun, Part Shade",Medium,,Zone 4 to 9,,"Deer, Drought, Clay Soil",,,Low,,"Easily grown in average, medium, well-drained soil in full sun to part shade. Prefers moist, loamy soils. Tolerates some drought. When grown in full sun, plants often require no pruning or staking. When grown in some shade and/or in rich soils, however, plants tend to become more open and floppy and often require staking or pruning. For a neater appearance, particularly for shade-grown plants, consider cutting back stems by 1/2 to 1/3 after flowering to promote bushy growth and, if desired, a more rounded foliage mound. Although cutting back most Amsonias to 6-8"" after bloom is recommended in order to help maintain neatness and increase foliage density, such trimming is usually not needed in the case of this compact cultivar.","Borders, rock gardens, cottage gardens, open woodland areas, rain gardens. Best when massed. Flowers can be used in fresh cut arrangements.",,,No serious insect or disease problems. May require staking to avoid flopping in overly rich soils or shady conditions. Rust may occur. Deer tend to avoid this plant.,https://www.missouribotanicalgarden.org/PlantFinder/PlantFinderDetails.aspx?taxonid=262985&isprofile=0&,NA,NA,https://newmoonnursery.com/nursery-plants/amsonia-tabernaemontana-v-montana/,NA,20250611_AN
"Herbaceous, Perennial",ATS,Amsonia tabernaemontana 'Salicifolia',WILLOW LEAF BLUE STAR,2 - 3,2 - 3,Blue,May,"Full Sun, Part Shade",Medium,,Zone 3 to 9,Butterflies,"Deer, Drought, Clay Soil",,,Low,,"Easily grown in average, medium, well-drained soil in full sun to part shade. Prefers moist, loamy soils. Tolerates some drought. When grown in full sun, plants often require no pruning or staking though they tend to lean. When grown in some shade and/or in rich soils, however, plants tend to become more open and floppy and often require staking or pruning. For a neater appearance, particularly for shade-grown plants, consider cutting back stems by 1/2 to 1/3 after flowering to promote bushy growth and, if desired, a more rounded foliage mound.","Borders, rock gardens, cottage gardens, open woodland areas, rain gardens. Best when massed. Flowers can be used in fresh cut arrangements.",,,"No serious insect or disease problems. Taller plants may require staking, particularly if grown in shade and not pruned after flowering. Deer tend to avoid this plant.",https://www.missouribotanicalgarden.org/PlantFinder/PlantFinderDetails.aspx?taxonid=276139&isprofile=0&hf=1,https://www.wildflower.org/plants/result.php?id_plant=AMTAS,https://www.pleasantrunnursery.com/plant-name/Amsonia-tabernaemontana-var--salicifolia,https://newmoonnursery.com/nursery-plants/amsonia-tabernaemontana-v-salicifolia/,NA,20250611_AN
"Herbaceous, Perennial",AC,Aquilegia canadensis,RED COLUMBINE,2 - 3,1 - 1.5,"Red, Pink, Yellow","Feb, Mar, Apr, May, Jun, Jul","Full Sun, Part Shade",Medium,FACU,Zone 3 to 8,Hummingbirds,"Rabbit, Deer, Drought, Dry Soil","Sandy, well-drained soils. Medium Loam, Sandy Loam, Sandy, Limestone-based. Not too rich.","Red columbine likes moisture but must be in well drained soil. Rich garden soil encourages rank vegetative growth and weak stems and shortens the plant's lifespan, while plants in thin, sandy soils maintain a tight, compact habit and can live for many years. It is",Medium,Partly shaded to shaded woodland habitat with calcareous soils that are not too rich. Central Texas populations primarily in solution-pitted limestone areas in shade.,"Easily grown in average, medium, well-drained soil in full sun to part shade. Wide range of soil tolerance as long as drainage is good. Prefers rich, moist soils in light to moderate shade. Freely self-seeds and will naturalize to form large colonies in optimum growing conditions. Remove flowering stems after bloom to encourage additional bloom. Keep soils uniformly moist after bloom to prolong attractive foliage appearance. When foliage depreciates, plants may be cut to the ground.","Borders, cottage gardens, open shade gardens, woodland gardens or naturalized areas. Also a good selection for a hummingbird garden. Continue to water plants after bloom to enjoy the ground cover effect of the attractive foliage.","Use Ornamental: Valued as a shade-loving, Use Wildlife: Blooms attract hummingbirds, bees, butterflies, and hawk moths. Seeds consumed by finches and buntings., Use Other: Native","Maintenance: Be careful of overwatering in summer - the crowns can rot. Cut back old seed heads and stems in summer to keep tidy looking. To maintain pure strains of any Aquilegia species and prevent hybridizing (which A. canadensis will readily do), keep different species widely separated - not a surefire protection, but reduces the likelihood.",This species has very good resistance to leaf miner which often causes severe damage to the foliage of many other columbine species and hybrids.,https://www.missouribotanicalgarden.org/PlantFinder/PlantFinderDetails.aspx?kempercode=b400,https://www.wildflower.org/plants/result.php?id_plant=aqca,https://www.pleasantrunnursery.com/plant-name/Aquilegia-canadensis,https://newmoonnursery.com/nursery-plants/aquilegia-canadensis/,https://www.pinelandsnursery.com/aquilegia-canadensis-red-columbine-seed,20250611_AN
"Herbaceous, Perennial",AT1,Arisaema triphyllum,JACK-IN-THE-PULPIT,1 - 2,1 - 1.5,,,"Part Shade, Full Shade","Medium, Wet",FACW,Zone 4 to 9,,"Heavy Shade, Wet Soil, Black Walnut","Humus-rich, moist soils.","Jack-in-the-pulpit is an excellent woodsgarden plant, very easy to cultivate and requiring very little care. It thrives under a variety of conditions, but grows most vigorously in moist, shady, seasonally wet locations. A heavy, leafy wintercover should be left in place.",Medium,"Forest, Woodland, Swamp, Marsh","Best grown in fertile, medium to wet soil in part shade to full shade. Needs constantly moist soil rich in organic matter. Does poorly in heavy clay soils. May be grown from seed, but takes five years for plant to flower.","Best left undisturbed in the shady woodland garden, wild garden or native plant garden.",Use Wildlife: Birds and mammals eat the berries of this plant.,,No serious insect or disease problems.,https://www.missouribotanicalgarden.org/PlantFinder/PlantFinderDetails.aspx?taxonid=276310,https://www.wildflower.org/plants/result.php?id_plant=artr,NA,NA,NA,20250611_AN
"Herbaceous, Perennial",AI,Asclepias incarnata,SWAMP MILKWEED,3 - 4,2 - 3,Pink,"Jun, Jul, Aug",Full Sun,"Medium, Wet",OBL,Zone 3 to 6,"Hummingbirds, Butterflies, Food Source for Pollinators","Deer, Clay Soil, Wet Soil","Rich, wet, very muddy to average garden moisture. One of the few ornamentals that thrives in mucky clay soils. Prefers neutral to slightly acidic soil but will tolerate heavy clay.","With its showy flower clusters that attract butterflies and hummingbirds, swamp milkweed is underutilized in gardens. In moist soils or in a pond, it will thrive. The interesting seed pods look like other milkweeds. Swamp milkweed will inevitably have aphids. The insects are not a problem unless the plant looks sick; at that point an effective treatment is to spray the plant and aphids with soapy water. Another possible treatment is to support the plant part with your hand and blast it with high-pressure water. Good for wetland gardens and habitat.",Low,"Wet Meadow, Prairie, Field, Riparian, Swamp, Marsh. Most often found on the margins of flooded plains, lakes, ponds, waterways, marshes, swamps, and other wet areas.",Easily grown in medium to wet soils in full sun. Surprisingly tolerant of average well-drained soils in cultivation even though the species is native to swamps and wet meadows. Plants have deep taproots and are best left undisturbed once established. Foliage is slow to emerge in spring.,"Sunny borders, stream/pond banks, butterfly gardens. A good plant for low spots or other moist areas in the landscape.","Use Ornamental: Herbaceous, Use Wildlife: Milkweeds are an important food source for the monarch caterpillar., Use Food: Although milkweeds are poisonous raw, the young shoots, leaves and seed pods are all edible cooked. When placed in cold water, brought to a boil and simmered till tender, milkweeds are said to be delicately flavoured and harmless. (Poisonous Plants of N.C. State) The flower buds, nectar-sweet flowers and seeds are also edible. (Kershaw), Use Medicinal: In the past, the roots of swamp milkweed were simmered to make a tea taken in small quantities both as a general purge and to destroy and expel parasitic worms.",,No serious insect or disease problems.,https://www.missouribotanicalgarden.org/PlantFinder/PlantFinderDetails.aspx?kempercode=g410,https://www.wildflower.org/plants/result.php?id_plant=asin,https://www.pleasantrunnursery.com/plant-name/Asclepias-incarnata,https://newmoonnursery.com/nursery-plants/asclepias-incarnata/,https://www.pinelandsnursery.com/asclepias-incarnata-swamp-milkweed1-pot,20250611_AN
"Herbaceous, Perennial",AII,Asclepias incarnata 'Ice Ballet',ICE BALLET SWAMP MILKWEED,3 - 4,1.5 - 2,,,Full Sun,"Medium, Wet",,Zone 3 to 9,"Hummingbirds, Butterflies","Deer, Clay Soil, Wet Soil",,,Low,,Easily grown in medium to wet soils in full sun. Surprisingly tolerant of average well-drained soils in cultivation even though the species is native to swamps and wet meadows. Plants have deep taproots and are best left undisturbed once established. Foliage is slow to emerge in spring.,"Sunny borders, stream/pond banks, butterfly gardens. A good plant for low spots or other moist areas in the landscape.",,,No serious insect or disease problems.,https://www.missouribotanicalgarden.org/PlantFinder/PlantFinderDetails.aspx?taxonid=254189&isprofile=0,NA,https://www.pleasantrunnursery.com/plant-name/Asclepias-incarnata-Ice-Ballet,https://newmoonnursery.com/nursery-plants/asclepias-incarnata-ice-ballet/,NA,20250611_AN
"Herbaceous, Perennial",AS,Asclepias syriaca,COMMON MILKWEED,2 - 3,0.75 - 1,"White, Purple","Jun, Jul, Aug",Full Sun,"Dry, Medium",UPL,Zone 3 to 9,Butterflies,"Deer, Drought, Erosion, Dry Soil, Shallow-Rocky Soil","Medium to fine sandy, clayey, or rocky calcareous soils. Also found in well-drained loamy soils.",Not shade tolerant. Needs lots of sunlight.,Low,"Old fields, roadsides, and waste places.","Easily grown in average, dry to medium, well-drained soils in full sun. Drought tolerant. Does well in poor, dryish soils. Easily grown from seed, and will self-seed in the landscape if seed pods are not removed prior to splitting open. Can spread somewhat rapidly by rhizomes. Often forms extensive colonies in the wild.","Butterfly gardens, meadows, prairies, or naturalized/native plant areas. This plant is considered by many gardeners to be too vigorous and weedy for borders.","Use Food: According to the Field Guide to Medicinal Wild Plants or Edible Wild Plants, common milkweed is edible only under certain circumstances. Boiling can eliminate the bitter taste and toxicity of the, Use Other: Native",,No serious insect or disease problems. Somewhat weedy and can spread.,https://www.missouribotanicalgarden.org/PlantFinder/PlantFinderDetails.aspx?kempercode=b480,https://www.wildflower.org/plants/result.php?id_plant=ASSY,https://www.pleasantrunnursery.com/plant-name/Asclepias-syriaca,NA,https://www.pinelandsnursery.com/asclepias-syriaca,20250611_AN
"Herbaceous, Perennial",AT2,Asclepias tuberosa,BUTTERFLY MILKWEED,1 - 2.5,1 - 1.5,Orange,"May, Jun, Jul, Aug, Sep",Full Sun,"Dry, Medium",,Zone 3 to 9,"Butterflies, Food Source for Pollinators","Deer, Drought, Erosion, Dry Soil, Shallow-Rocky Soil",Prefers well-drained sandy soils. Tolerates drought.,Butterfly,Low,"Grows in prairies, open woods, canyons, and hillsides throughout most of the state, common in eastern two thirds of Texas, uncommon in the Hill Country. Plant in well-drained sand, loam, clay, or limestone.","Easily grown in average, dry to medium, well-drained soils in full sun. Drought tolerant. Does well in poor, dry soils. New growth tends to emerge late in the spring. Plants are easily grown from seed, but are somewhat slow to establish and may take 2-3 years to produce flowers. Mature plants may freely self-seed in the landscape if seed pods are not removed prior to splitting open. Butterfly weed does not transplant well due to its deep taproot, and is probably best left undisturbed once established.","Butterfly gardens, rock gardens, meadows, prairies, or naturalized/native plant areas. Also effective in sunny borders or slopes. Whether massing plants in large drifts or sprinkling them throughout a prairie or meadow, butterfly weed is one of our showiest native wildflowers.","Use Ornamental: Butterfly, Use Medicinal: Its tough root was chewed by First Nations People as a cure for pleurisy and other pulmonary ailments explaining its other common name, pleurisy root. (Niering), Use Other: This showy plant is frequently grown from seed in home gardens.","Maintenance: Needs to be transplanted carefully and requires good drainage. It takes 2 â 3 years before A. tuberosa produces its vibrant flowers, which appear in 2 â 3 inch clusters of orangish-red. Once established, it lasts for years, becoming thicker each year.","No serious insect or disease problems. Crown rot can be a problem in wet, poorly drained soils. Susceptible to rust and leaf spot.",https://www.missouribotanicalgarden.org/PlantFinder/PlantFinderDetails.aspx?kempercode=b490,https://www.wildflower.org/plants/result.php?id_plant=astu,https://www.pleasantrunnursery.com/plant-name/Asclepias-tuberosa,https://newmoonnursery.com/nursery-plants/asclepias-tuberosa/,https://www.pinelandsnursery.com/asclepias-tuberosa-butterfly-weed-seed,20250611_AN
"Herbaceous, Perennial",BA,Baptisia australis,"BLUE WILD INDIGO, BLUE FALSE INDIGO",3 - 4,3 - 4,"Violet, Purple","May, Jun, Jul","Full Sun, Part Shade","Dry, Medium",FACU,Zone 3 to 9,Butterflies,"Drought, Erosion, Clay Soil, Dry Soil, Shallow-Rocky Soil, Deer","Moist, well-drained, clays. Tolerates lime.",,Low,Wood edges; limestone glades; prairies,"Easily grown in average, dry to medium, well-drained soil in full sun to part shade. Best in full sun. Tolerates drought and poor soils. Over time, plants develop slowly expanding clumps with deep and extensive root systems, and should not be disturbed once established. May be grown from seed, but takes several years to establish. Plants take on more of a shrubby appearance and tend to open up after bloom. Trimming or shearing foliage after bloom helps maintain rounded plant appearance and obviates a possible need for staking, but eliminates the developing seed pods which are so attractive.","Borders, cottage gardens, prairies, meadows and native plant gardens. Effective in naturalized settings. Best as a specimen or in small groups.","Use Medicinal: Amerindians used root tea as emetic and purgative; cold tea given to stop vomiting. Root poulticed as an anti-inflammatory. Held in mouth to treat toothaches. Toxic., Use Other: Plant juice turns purple on exposure and is a fair substitute for true indigo in making blue dye.",,"No serious insect or disease problems. Taller plants may need support, particularly when grown in part shade locations. Sensitive to juglone. Tends to perform poorly when planted close to black walnut trees.",https://www.missouribotanicalgarden.org/PlantFinder/PlantFinderDetails.aspx?kempercode=b660,https://www.wildflower.org/plants/result.php?id_plant=BAAU,https://www.pleasantrunnursery.com/plant-name/Baptisia-australis,https://newmoonnursery.com/nursery-plants/baptisia-australis/,https://www.pinelandsnursery.com/baptisia-australis-blue-wild-indigo-seed,20250611_AN
"Herbaceous, Perennial",CP,Caltha palustris,MARSH MARIGOLD,1 - 1.5,1 - 1.5,,,"Full Sun, Part Shade",Wet,OBL,Zone 3 to 7,"Hummingbirds, Pollinators","Deer, Wet Soil, Wet Site Tolerant","Muddy, humus-rich soil.","Marsh marigold requires little care other than protection from drying, winter and early spring winds.",Low,"Wet woods, marshy hollows, stream edges","Grow in full sun to part shade in shallow water at the margins of a pond or water garden or in wet, boggy soils. Best flowering usually occurs in full sun, but plants appreciate some part shade in the heat of the summer. If sited in full sun in hot summer climates such as the St. Louis area, plants may go dormant in summer. May be grown from seed.",Water or bog gardens. Pond edges.,"Use Food: EDIBLE PARTS: Cooked, early spring greens are edible. Cover the young leaves with 2-3 changes of boiling water until barely tender; cut into bite-sized pieces, salt lightly, and cover with butter and some vinegar. Tightly closed buds can be pickled after covering with boiling water as described for leaves. Do not boil. The leaves are sometimes used as potherbs but require several short boilings with changes of water between. (Niering)",,No serious insect or disease problems. Susceptible to powdery mildew and rust.,https://www.missouribotanicalgarden.org/PlantFinder/PlantFinderDetails.aspx?kempercode=a635,https://www.wildflower.org/plants/result.php?id_plant=capa5,https://www.pleasantrunnursery.com/plant-name/Caltha-palustris,https://newmoonnursery.com/nursery-plants/caltha-palustris/,NA,20250611_AN
"Herbaceous, Perennial",CG,Chelone glabra,WHITE TURTLEHEAD,2 - 3,1.5 - 2.5,"White, Pink","Jul, Aug, Sep",Part Shade,"Medium, Wet",OBL,Zone 3 to 8,Butterflies,"Erosion, Wet Soil","Light, rich, wet to moist soils.",,Low,Brushy marshes; stream banks; wet ditches; low meadows; woodlands,"Best grown in moist to wet, rich, humusy soils in part shade. Appreciates a good composted leaf mulch, particularly in sunny areas. Consider pinching back the stem ends in spring to reduce mature plant height, especially if growing plants in strongly shaded areas where they are more likely to need some support. In optimum environments, however, staking is usually not required. Slowly spreads by rhizomes.",Shade or woodland gardens. Bog gardens. Pond or water garden peripheries. Wildflower or native plant gardens. Borders as long as the soil moisture requirements can be met.,,,"No serious insect or disease problems. Some susceptibility to mildew, particularly if soils are kept on the dry side and/or air circulation is poor. If grown in too much shade, plants may need some support.",https://www.missouribotanicalgarden.org/PlantFinder/PlantFinderDetails.aspx?kempercode=j780,https://www.wildflower.org/plants/result.php?id_plant=chgl2,https://www.pleasantrunnursery.com/plant-name/Chelone-glabra,https://newmoonnursery.com/nursery-plants/chelone-glabra/,NA,20250611_AN
"Herbaceous, Perennial",CL,Coreopsis lanceolata,LANCELEAF TICKSEED,1 - 2,1 - 1.5,Yellow,"Apr, May, Jun",Full Sun,"Dry, Medium",UPL,Zone 4 to 9,Butterflies,"Deer, Drought, Dry Soil, Shallow-Rocky Soil","Sandy, gravelly soils. Sandy, Sandy Loam, Medium Loam, Clay Loam, Clay, Acid-based, Calcareous",Lance-leaved coreopsis is the most common coreopsis and is easy to grow. It is drought tolerant but is not a reliably perennial. However it self-sows readily and can become weedy. The showy golden flowers are nice in a vase and are a popular plant for visiting pollinators. It should have frequent deadheading to keep it in bloom well into the summer.,Medium,"Open woodlands, Prairie, Plains, Meadows, Pastures, Savannas","Easily grown in dry to medium moisture, well-drained soil in full sun. Thrives in poor, sandy or rocky soils with good drainage. Tolerant of heat, humidity and drought. Prompt deadheading of spent flower stalks encourages additional bloom and prevents any unwanted self-seeding. Freely self-seeds, and in optimum growing conditions will naturalize to form large colonies. Plants may be cut back hard in summer if foliage sprawls or becomes unkempt. If grown in borders, division may be needed every 2-3 years to maintain robustness.","Best naturalized in native wildflower gardens, rock gardens, meadows or prairies. Good plant for areas with poor, dry soils. Can be effective in borders, but self-seeding tendencies may need to be kept in check to maintain a more formal appearance.",,Maintenance: May be selectively thinned to improve appearance by removing clumps from the interior of the planting. Mulching helps conserve moisture and control weeds.,"No serious insect or disease problems. Can be an aggressive self-seeder. Tends to sprawl, particularly if grown in moist and/or fertile soils. Crown rot may occur if grown in moist, poorly drained soils.",https://www.missouribotanicalgarden.org/PlantFinder/PlantFinderDetails.aspx?kempercode=j880,https://www.wildflower.org/plants/result.php?id_plant=cola5,https://www.pleasantrunnursery.com/plant-name/Coreopsis-lanceolata,https://newmoonnursery.com/nursery-plants/coreopsis-lanceolata/,https://www.pinelandsnursery.com/coreopsis-lanceolata-lanceleaf-tickseed-seed,20250611_AN
