Shrubs,LR,Leucothoe racemosa,FETTERBUSH,3 - 8,2 - 4,White,"May, Jun",Part Shade,"Medium, Wet",FACW,Zone 5 to 9,"Butterflies, Pollinators, Food Source for Pollinators","Erosion, Black Walnut Tolerant","Moist, well-drained, acidic soil","Very difficult to keep in good condition under normal conditions of cultivation. Tends to become weak and susceptible to leaf spot under even mild stress. To avoid this, plant in moist soil with good drainage and then avoid the typical, heavy lawn watering. Can take brief seasonal flooding, though.",Low,Pocosins; low woods; shrub-tree bogs & bays,"Grow in average, medium to wet, well-drained soils in part shade. Prefers a moist, cool, acidic soil. Can be grown in full sun, but must have good moisture. Does not tolerate drought or windy conditions. Although winter hardy to Zone 5, this shrub should be planted in a protected location and given a good winter mulch in the St. Louis area to insure winter survival. Suckers to form colonies.","Small shrub for rock garden, on slopes, bank stabilizer, border, foundations or underplanting for larger shrubs.","Use Ornamental: A glossy-leaved, showy-flowered, Use Wildlife: Flowers visited by bees",Maintenance: No maintenance recommended except cutting back to keep it at a favored height. A plant that is easy care if established in a favorable site and then left on its own.,No serious insect or disease problems. Root rot and leaf spot can develop.,https://www.missouribotanicalgarden.org/PlantFinder/PlantFinderDetails.aspx?taxonid=446191,https://www.wildflower.org/plants/result.php?id_plant=LYLU3,https://www.pleasantrunnursery.com/plant-name/Actaea-racemosa,,https://www.pinelandsnursery.com/cornus-racemosa-gray-dogwood-1-pot,
Shrubs,LB,Lindera benzoin,SPICEBUSH,6 - 12,6 - 12,,,Part Shade,Medium,FACW,Zone 4 to 9,"Birds, Butterflies","Deer, Drought, Heavy Shade, Clay Soil, Wet Soil, Black Walnut","Moist, sandy, well-drained soils. Caliche type, Limestone-based, Sandy Loam, Medium Loam",Spicebush is a fast-growing,Low,"Low, deciduous woods; stream banks; swamps","Easily grown in average, medium, well-drained soils in part shade. Fall color is best with more sun. Tolerates full shade, but habit becomes more open and wide-spreading. Also tolerant of full sun, but good soil moisture is required.","Shrub borders, shade or woodland gardens, moist areas along streams or ponds, native plant gardens or naturalized plantings.","Use Food: A tea can be made from the aromatic leaves and twigs, and the dried and powdered",,No serious insect or disease problems.,https://www.missouribotanicalgarden.org/PlantFinder/PlantFinderDetails.aspx?kempercode=d890,https://www.wildflower.org/plants/result.php?id_plant=libe3,https://www.bing.com/search?q=%22Lindera+benzoin%22+site%3Apleasantrunnursery.com&rdr=1&rdrig=5E52F458C86D4464921E8876D1979C9B#,https://www.bing.com/search?q=%22Lindera+benzoin%22+site%3Anewmoonnursery.com&rdr=1&rdrig=FAC69C5E762E402B94937EC9311CE956#,https://www.bing.com/search?q=%22Lindera+benzoin%22+site%3Apinelandsnursery.com&rdr=1&rdrig=5210A36611794517A9D6B5B3B2C909EE#,
Shrubs,MP,Myrica pensylvanica,NORTHERN BAYBERRY,4 - 5,5 - 7,Yellow,"Jul, Aug, Sep, Oct","Full Sun, Part Shade","Dry, Medium",FAC,Zone 3 to 6,Birds,"Drought, Erosion, Wet Soil","Clay, Loam, Sand","Bayberry tolerates salt spray and a wide variety of wet to dry, hot to cold growing conditions. Be sure to obtain plants similar to climatic condition in your garden. Both male and female plants are necessary for berries. From NJ to LA, another coastal bayberry occurs, M. heterophylla. It is similar with smaller fruits.",Low,"Ledges, wood borders; thickets","Easily grown in average, dry to medium, well-drained soils in full sun to part shade. Prefers moist, peaty or sandy, acidic soils, but tolerates a wide range of soils and growing conditions, including poor soils, wet soils, drought, high winds and salt spray (seashore or road salt conditions). Groupings of plants need a least one male plant to facilitate pollination of the female plants and subsequent fruit set. Shrubs tend to sucker, and may form sizable colonies in optimum growing conditions. Shrubs are semi-evergreen in southern end of growing range.","Best in groups or massed. A versatile shrub that can be used in woodland gardens or shrub borders, as a screen or informal hedge, in wet or shady sites, or on a bank for erosion control. Salt tolerance makes it appropriate for locations near roads that are salted in winter. Interesting plant for grouping in a corner of a large herb garden.",Use Wildlife: Eaten by many winter birds.,,No serious insect or disease problems.,https://www.missouribotanicalgarden.org/PlantFinder/PlantFinderDetails.aspx?taxonid=256525,https://www.wildflower.org/plants/result.php?id_plant=mope6,https://www.pleasantrunnursery.com/plant-name/Myrica-pensylvanica,,https://www.pinelandsnursery.com/morella-pensylvanica-northern-bayberry-1-pot,
Shrubs,RV,Rhododendron viscosum,SWAMP AZALEA,3 - 5,3 - 5,"Pink, White","May, Jun, Jul",Part Shade,"Medium, Wet",OBL,Zone 4 to 9,"Hummingbirds, Butterflies, Bees and other pollinators","Rabbit, Wet Soil",Wet soil.,This is one of the last azaleas to bloom in spring. It is a variable species with several varieties and forms. Good cultural practices reduce the incidence of disease and insect damage. Flood tolerant.,Medium,Swamps; bogs; stream margins,"Best grown in acidic, humusy, well-drained loams in part shade. This species of azalea is tolerant of moist to wet soils including ones with somewhat poor drainage (its native habitat is swampy lowland areas). It also tolerates periodic flooding, but will not grow in soils where the roots are submerged in water. Root rot is less likely to occur with this species. Prefers a sun dappled shade or high open part shade. Foliage may scorch in full sun unless soils are kept uniformly moist. Roots must never be allowed to dry out. Acidify soils prior to planting and thereafter as needed. This azalea should never be planted near a black walnut or butternut tree (roots of both trees produce toxic juglones which will typically damage or kill rhododendrons/azaleas growing within or close to the drip line of either tree). It is best sited in a location protected from strong winter winds. This shrub has a shallow, fibrous root system (do not cultivate around the shrub) and will benefit from a good mulch (wood chips, bark or pine needles) for retention of moisture, stabilization of soil temperatures and winter protection. Clip off spent flower clusters immediately after bloom as practicable. Plants will slowly naturalize by root suckers.","Best grouped in shrub borders, mixed borders, open woodland gardens, native plant gardens and open shade gardens. Effective near patios or decks. Specimen around the home. Plants in groups with earlier blooming azaleas to extend the annual azalea bloom period. Plants often thrive when sited in moist soils near stationary or moving water. Good cut flower.",Use Wildlife: Low.,,"Azaleas are susceptible to many insect and disease problems, including but not limited to canker, crown rot, root rot, leaf spot, rust, powdery mildew, aphids, borers, lacebugs, leafhoppers, mealybugs, mites, nematodes, scale, thrips and whitefly. A healthy plant in the proper environment with proper care should have limited problems, however.",https://www.missouribotanicalgarden.org/PlantFinder/PlantFinderDetails.aspx?taxonid=280018,https://www.wildflower.org/plants/result.php?id_plant=rhvi2,https://www.pleasantrunnursery.com/plant-name/Rhododendron-atlanticum-Fragrant-Star,,https://www.pinelandsnursery.com/rhododendron-viscosum-swamp-azalea-5,
Shrubs,RA,Rhus aromatica,FRAGRANT SUMAC,2 - 6,6 - 10,Yellow,"Apr, May, Jun","Full Sun, Part Shade","Dry, Medium",UPL,Zone 3 to 9,"Birds, Butterflies, Food Source for Pollinators","Rabbit, Drought, Erosion, Clay Soil, Dry Soil, Shallow-Rocky Soil, Black Walnut","Dry, rocky soils. Sandy, Sandy Loam, Medium Loam, Clay Loam Clay, Rocky, Caliche type, Limestone-based","In spring, fragrant sumac flowers appear before the foliage. This",Low,"Dry, rocky prairies, old fields & open woods","Easily grown in average, dry to medium, well-drained soil in full sun to part shade. Tolerant of wide range of soils except those that are poorly drained.",Good for stabilizing embankments or for hard-to-cover areas with poorer soils or for wild parts of native plant gardens or naturalized areas. Informal hedges.,"Use Ornamental: Several cultivated varieties of this, Use Wildlife: The berries are winter food. Its berries provide food for small animals and birds such as Townsend's Solitaires., Use Food: Its berries provide food for small animals and birds such as Townsend's Solitaires.",,"No serious insect or disease problems. Some susceptibility to leaf spot, rust, scale, aphids and mites. Nipple galls on foliage are a somewhat common, but generally cosmetic problem.",https://www.missouribotanicalgarden.org/plantfinder/PlantFinderDetails.aspx?taxonid=275952,https://www.wildflower.org/plants/result.php?id_plant=rhar4,https://www.pleasantrunnursery.com/plant-name/Rhus-aromatica,,https://www.pinelandsnursery.com/rhus-aromatica,
Shrubs,RC,Rosa carolina,CAROLINA ROSE,3 - 6,5 - 10,,,Full Sun,"Medium, Wet",FACU,Zone 4 to 9,"Birds, Butterflies, Hummingbirds, Pollinators, Food Source for Wildlife","Salt Tolerant, Wet Site Tolerant",Rocky soils.,Susceptible to fungal problems.,Medium,"Dry, open woods; hills; prairies; roadsides","Best grown in average, medium to wet, well-drained soil in full sun. Best flowering and disease resistance occur in full sun. Water deeply and regularly (mornings are best). Avoid overhead watering. Good air circulation promotes vigorous and healthy growth and helps control foliar diseases. Summer mulch helps retain moisture and keep roots cool. Remove and destroy diseased leaves from plants (as practicable), and clean up and destroy dead leaves from the ground around the plants both during the growing season and as part of a thorough clean-up during winter (dormant season). Crowns appreciate protection in cold winter climates. Prune in late winter to early spring.","Mass in borders, rose garden, meadows, naturalized areas or native plant gardens.",,,"Roses are susceptible to a large number of diseases, the most common of which are black spot, powdery mildew, rust and rose rosette. Although good cultural practices are the first line of defense in disease control, regular preventative fungicide applications throughout the growing season are generally required in humid climates with regular summer rainfall such as the St. Louis area. This species rose has better natural resistance to the aforementioned diseases than most hybrid roses. Potential insect problems include aphids, beetles, borers, scale, thrips, rose midges, leafhoppers and spider mites.",https://www.missouribotanicalgarden.org/PlantFinder/PlantFinderDetails.aspx?kempercode=f370,https://www.wildflower.org/plants/result.php?id_plant=robl,https://www.pleasantrunnursery.com/plant-name/Rosa-carolina,https://newmoonnursery.com/nursery-plants/liatris-microcephala/,https://www.pinelandsnursery.com/rosa-carolina-carolina-rose-1-pot,
Shrubs,SC,Sambucus canadensis,ELDERBERRY,5 - 12,5 - 12,White,"May, Jun","Full Sun, Part Shade","Medium, Wet",,Zone 3 to 9,"Birds, Butterflies","Erosion, Clay Soil, Wet Soil","Tolerates a wide variety of wet to dry soils but prefers rich, moist, slightly acid soil.",This plant was used by,High,"Alluvial forests; bogs; ditches; drier, old fields. Edges of riparian thickets in Central and East Texas.","Grow in medium to wet, well-drained soils in full sun to part shade. Tolerates a wide range of soils, but prefers moist, humusy ones. Spreads by root suckers to form colonies. Prune suckers as they appear unless naturalizing. A large number of late winter or early spring pruning options include (a) pruning out dead or weakened stems, (b) shortening one year stems or (c) cutting back to the ground to rejuvenate. Some horticulturists recommend a hard spring pruning for maintaining best foliage and habit.","Group or mass in naturalized areas where suckering spread may be appreciated. Attractive flowers and interesting fruits. Landscape specimen, shrub borders, screens, backgrounds, stream/pond peripheries or low spots. Good sprawling hedge.","Use Wildlife: Berries are relished by many bird species and mammals. Deer eat twigs and leaves., Use Food: Elderberries, inedible when fresh and raw, are used for making jelly, preserves, pies, and wine., Use Medicinal: The",,"No serious insect or disease problems. Some susceptibility to canker, powdery mildew, leaf spot, borers, spider mites and aphids. Branches are susceptible to damage from high winds or from heavy snow/ice in winter. Plants will spread by root suckers.",https://www.missouribotanicalgarden.org/PlantFinder/PlantFinderDetails.aspx?kempercode=f470,https://www.wildflower.org/plants/result.php?id_plant=sanic4,https://www.pleasantrunnursery.com/plant-name/Sambucus-canadensis-Adams,,https://www.pinelandsnursery.com/sambucus-canadensis-black-elderberry-1-pot,
Shrubs,SL2,Spiraea latifolia,MEADOWSWEET,3 - 4,3 - 4,White To Pink,"Jun, Jul, Aug, Sep","Full Sun, Part Shade","Medium, Wet",FACW,Zone 3 to 7,"Butterflies, Food Source for Pollinators","Deer, Wet Soil",Moist soils.,,Low,Moist slopes & meadows,"Grow in average, medium to wet, well-drained soil in full sun to part shade. Prefers full sun. Needs constant moisture, and soil must not be allowed to dry out. Remove spent flower clusters to promote additional bloom.","Effective along streams or ponds, in low spots or boggy areas, or, with regular watering, in a border or cottage garden.",,,"No serious problems. Susceptible to many of the diseases and insects which attack other members of the rose family, including leaf spots, fireblight, powdery mildew, rots, aphids, leaf roller and scale.",https://www.missouribotanicalgarden.org/PlantFinder/PlantFinderDetails.aspx?taxonid=286372,https://www.wildflower.org/plants/result.php?id_plant=SPALL,https://www.pleasantrunnursery.com/plant-name/Bullseye_Mountain_Laurel,,https://www.pinelandsnursery.com/spiraea-latifolia-meadowsweet-1-pot,
Shrubs,ST,Spiraea tomentosa,STEEPLEBUSH,2 - 4,3 - 5,"Red, Pink, Purple","Jul, Aug, Sep",Full Sun,"Medium, Wet",FACW,Zone 3 to 8,Butterflies,"Deer, Erosion","Wet, moderately acid, soils.",Steeplebush needs sun; it will dwindle in shade.,Low,Wet prairies & meadows; marshes; roadsides,"Easily grown in average, acidic, moist to wet soils in full sun. Tolerates light shade. Tolerates a wide range of soils. Remove faded flower clusters as practicable to encourage additional bloom. Flowers on new wood, so prune in late winter to early spring if needed. Spreads by suckers to form colonies.","Needs moist acidic soils in order to grow well. Good selection for pond margins, low spots or other moist locations in the landscape. Mass or group. Low hedge for paths and walkways. Incorporate into foundation planting.",Use Wildlife: Intermediate.,,"No serious insect or disease problems. Susceptible to many of the diseases that attack other rose family members, including leaf spot, fire blight and powdery mildew. Potential insect pests include aphids, leaf roller, caterpillars and scale.",https://www.missouribotanicalgarden.org/PlantFinder/PlantFinderDetails.aspx?kempercode=e412,https://www.wildflower.org/plants/result.php?id_plant=spto2,https://www.pleasantrunnursery.com/plant-name/Spiraea-tomentosa,,https://www.pinelandsnursery.com/spiraea-tomentosa-steeplebush-1-pot,
Shrubs,VC,Vaccinium corymbosum,HIGHBUSH BLUEBERRY,6 - 12,8 - 12,,"May, Jun","Full Sun, Part Shade","Medium, Wet",FACW,Zone 5 to 8,"Birds, Butterflies, A Favorite of Honey Bees",Wet Soil,"Wet to dry, acid, rocky soils to organic peats.",Extremely susceptible to chlorosis due to alkalinity. Benefits from mulch. Prune after fruiting.,Medium,Swamps; bogs; dry barrens; oak woods,"Best grown in acidic (pH of 4.8 to 5.2), organically rich, medium to wet, well-drained soils in full sun to part shade. Shallow, fibrous roots need constant moisture and good drainage. Plants appreciate a good organic mulch. Although blueberries are self-fertile, cross-pollination produces the best fruit crop (larger berries and larger yields). Therefore, it is best to plant more than one variety that will bloom at the same time. In addition, blueberry season can be extended by planting early, mid-season and late varieties which will collectively ripen from early June to the end of the summer (St. Louis area). Best to remove flowers from plants in the year of planting and in the following year so as to prevent fruit set and to encourage new vegetative growth. Prune as needed in late winter beginning in the third year after planting.","Useful for ornamental purposes (flowers, fruit, quality summer foliage and fall color) as well as for fruit production (blueberries). It is effective in shrub borders or as part of less formal shrub plantings in areas such as native plant gardens or open woodlands. Particularly effective in conjunction with rhododendrons and azaleas which share similar acidic soil requirements. Also makes an excellent hedge with the added benefits of fruit which can be harvested or left for the birds.","Use Wildlife: Berries are relished by most birds and mammals. Browsers eat foliage. Attracts 30 species of birds including: American Robin, Eastern Bluebird, Scarlet Tanager, Eastern and Spotted Towhees, Gray Catbird, Northern Mockingbird, Brown Thrasher, and Northern Cardinal (Audubon at Home)., Use Food: Fruit",,"Birds love the fruit, so plants may need to be covered with netting as the fruit begins to ripen in order to protect the crop. Chlorosis (yellowing of leaves) may occur in high pH (alkaline) soils. Potential but infrequent disease problems include stem blight, root rot, anthracnose, cane cankers, mildew and botrytis. Blueberry maggot, cherry fruit worm and spotted wing drosophila may attack the fruit. Mummy berry is a fungal disease that causes the berries to shrivel and drop.",https://www.missouribotanicalgarden.org/PlantFinder/PlantFinderDetails.aspx?taxonid=279992,https://www.wildflower.org/plants/result.php?id_plant=vaco,https://www.pleasantrunnursery.com/plant-name/Vaccinium_corymbosum_Blue_Jay,,https://www.pinelandsnursery.com/vaccinium-corymbosum-highbush-blueberry-5-pot,
Shrubs,VA,Viburnum acerifolium,MAPLELEAF VIBURNUM,3 - 6,2 - 4,White,"Apr, May, Jun, Jul, Aug","Full Sun, Part Shade",Medium,FACU,Zone 3 to 8,"Birds, Butterflies",Black Walnut,"Dry, rocky soils. Sandy, Sandy Loam, Medium Loam, Clay Loam, Clay, Acid-based","Suckers profusely to form large, loose, open colonies. Susceptible to Viburnum Leaf Beetle.",Low,"Thickets, Shaded woods. Mesic, mixed woods; bluffs; ravines","Easily grown in average, medium moisture, well-drained soil in full sun to part shade. This shrub is generally more shade tolerant than many of the other species of Viburnum . Prefers moist loams, but tolerates a wide range of soils. Established plants have some drought tolerance. Prune as needed immediately after flowering. Plants will naturalize by suckering to form colonies if suckers are not removed.","Naturalize in open woodland areas. Also may be used in shrub borders, foundations or hedges.","Use Ornamental: Color, Blooms ornamental, Fruits ornamental, Fall conspicuous, Accent, Use Wildlife: Birds eat the blue berries. Nectar-bees, Nectar-butterflies, Nectar-insects, Browse, Fruit-birds",,No serious insect or disease problems.,https://www.missouribotanicalgarden.org/PlantFinder/PlantFinderDetails.aspx?kempercode=a192,https://www.wildflower.org/plants/result.php?id_plant=VIAC,https://www.pleasantrunnursery.com/plant-name/Viburnum-acerifolium,,https://www.pinelandsnursery.com/viburnum-lentago-nannyberry-2-pot,
Shrubs,VD,Viburnum dentatum,ARROWWOOD VIBURNUM,6 - 10,6 - 10,White,"May, Jun, Jul","Full Sun, Part Shade",Medium,FAC,Zone 2 to 8,"Birds, Butterflies","Clay Soil, Black Walnut","Dry to wet, acid soils and sands.","Flood, insect and disease tolerant. Suckers freely from base and transplants well. Most soil-adaptable of the viburnums. Pest free.",Low,Stream banks; moist woods,"Easily grown in average, medium moisture, well-drained soils in full sun to part shade. Prefers moist loams, but tolerates a wide range of soils. Established plants have some drought tolerance. Prune as needed immediately after flowering.","Not highly ornamental, but exceedingly winter hardy, vigorous and reliable. Shrub borders. Tall hedge or screen. Background for native plantings.","Use Wildlife: Gamebirds, songbirds and small mammals. Attracts Eastern Bluebird, Northern Flicker, Gray Catbird, and American Robin.",,Watch for whiteflies. Otherwise no serious insect or disease problems.,https://www.missouribotanicalgarden.org/PlantFinder/PlantFinderDetails.aspx?kempercode=m720,https://www.wildflower.org/plants/result.php?id_plant=vide,https://www.pleasantrunnursery.com/plant-name/Viburnum-dentatum-Blue-Muffin,,https://www.pinelandsnursery.com/viburnum-dentatum-arrowwood-viburnum-1-pot,
Shrubs,VL,Viburnum lentago,NANNYBERRY,14 - 16,6 - 12,White,May,"Full Sun, Part Shade",Medium,FAC,Zone 2 to 8,"Birds, Butterflies, Food Source for Pollinators",Air Pollution,"Sand, loam, clay, caliche, limestone. Poor drainage and saline soils okay.",Tolerates drought and flooding. Will go dormant during hard winters.,Low,Anywhere from ditches and roadways to beaches and fields.,"Easily grown in average, medium, well-drained soil in full sun to part shade. Prune immediately after flowering since flower buds form in summer for the following year. Remove root suckers to control spread unless naturalization is desired.",Shrub borders. Tall hedge or screen. Background for native plantings. Suckering habit is conducive to naturalizing.,"Use Ornamental: A great groundcover for full sun and part shade areas, with trailing foliage and charming, mini-verbena-like flowers. Would also do well as a pot plant., Use Wildlife: Attracts numerous insect pollinators.","Maintenance: Water in dry areas or seasons to maintain a solid cover. Do not mow while blooming, as it can take years to recover.",No serious insect or disease problems. Mildew and leaf spot are occasional problems.,https://www.missouribotanicalgarden.org/PlantFinder/PlantFinderDetails.aspx?kempercode=m750,https://www.wildflower.org/plants/result.php?id_plant=phno2,https://www.pleasantrunnursery.com/plant-name/Viburnum-acerifolium,,https://www.pinelandsnursery.com/viburnum-lentago-nannyberry-2-pot,
Shrubs,VN1,Viburnum nudum,POSSUMHAW VIRBURNUM,5 - 12,5 - 12,White,"Jun, Jul","Full Sun, Part Shade","Medium, Wet",FACW,Zone 5 to 9,Butterflies,Wet Soil,"Adaptable but prefers wet, mucky, acid soils.","Flood, cold, insect and disease tolerant. Transplants well.",Low,"Savannas; low, wet woods; bogs","Easily grown in average, medium to wet, well-drained soil in full sun to part shade. Prefers moist loams, but tolerates a wide range of soils including boggy ones. Prune lightly, only as needed, in fall. Pruning after flowering may be done, but will eliminate some of the late summer fruit display. For best cross-pollination and subsequent fruit display, plant shrubs in groups rather than as single specimens.","Specimen or groups. Shrub borders, foundations, hedges or roadside plantings. Good selection for low spots and peripheries of water gardens, streams or ponds.","Use Wildlife: Songbirds, water birds, shorebirds, small mammals",,No serious insect or disease problems.,https://www.missouribotanicalgarden.org/PlantFinder/PlantFinderDetails.aspx?taxonid=278959,https://www.wildflower.org/plants/result.php?id_plant=VINU,https://www.pleasantrunnursery.com/plant-name/Viburnum-nudum-Brandywine,,https://www.pinelandsnursery.com/viburnum-nudum-possumhaw-tubeling,
Shrubs,VT,Viburnum trilobum,CRANBERRY VIBURNUM,8 - 12,8 - 12,White,"May, Jun, Jul","Full Sun, Part Shade",Medium,FAC,Zone 2 to 7,"Birds, Butterflies",s a wide range of soils. Prune as needed immediately after flowering.,"Dry to wet, acid soils and sands.","Flood, insect and disease tolerant. Suckers freely from base and transplants well. Most soil-adaptable of the viburnums. Pest free.",Low,Stream banks; moist woods,"Easily grown in average, moist, well-drained soils in full sun to part shade. Prefers loams with consistent moisture, but tolerates a wide range of soils. Prune as needed immediately after flowering.",Shrub borders or foundations. Woodland margins. Hedge or screen.,"Use Wildlife: Gamebirds, songbirds and small mammals. Attracts Eastern Bluebird, Northern Flicker, Gray Catbird, and American Robin.",,"Watch for aphids. Viburnum crown borer can cause stem dieback. Some susceptibility to bacterial leaf spot, stem blight and powdery mildew.",https://www.missouribotanicalgarden.org/PlantFinder/PlantFinderDetails.aspx?kempercode=c365,https://www.wildflower.org/plants/result.php?id_plant=vide,https://www.pleasantrunnursery.com/plant-name/Viburnum-trilobum-Bailey-Compact,,https://www.pinelandsnursery.com/viburnum-trilobum-cranberry-viburnum-1-pot,
