"Herbaceous, Perennial",EP,Echinacea purpurea,PURPLE CONEFLOWER,2 - 5,1.50 - 2,"Pink, Purple","Apr, May, Jun, Jul, Aug, Sep","Full Sun, Part Shade","Dry, Medium",,Zone 3 to 8,"Birds, Butterflies","Deer, Drought, Clay Soil, Dry Soil, Shallow-Rocky Soil","Well-drained, sandy or richer soils.",Echinacea is a suitable addition to a prairie garden and attractive in flower arrangements. It is a popular,Low,"Well-drained limestone, sand, clay, loam. Rocky, open woods; thickets; prairies.","Easily grown in average, dry to medium, well-drained soil in full sun to part shade. Best in full sun. An adaptable plant that is tolerant of drought, heat, humidity and poor soil. Divide clumps when they become overcrowded (about every 4 years). Plants usually rebloom without deadheading, however prompt removal of spent flowers improves general appearance. Freely self-seeds if at least some of the seed heads are left in place.","Excellent, long-blooming flower for massing in the border, meadow, native plant garden, naturalized area, wildflower garden or part shade area of woodland garden. Often massed with black-eyed Susans (rudbeckias).","Use Wildlife: Echinacea spp. attract butterflies and hummingbirds., Use Medicinal: Extracts thought to improve white blood count. Echinacin stops bacteria from forming the hyaluronidase enzyme, which helps make cells more susceptible to infection. Its a mild natural antibiotic. Small amounts taken a few times daily are better than large dose",,Japanese beetle and leaf spot are occasional problems. Susceptible to aster yellows disease.,https://www.missouribotanicalgarden.org/PlantFinder/PlantFinderDetails.aspx?kempercode=c580,https://www.wildflower.org/plants/result.php?id_plant=ecpu,https://www.pleasantrunnursery.com/plant-name/Echinacea-purpurea,https://newmoonnursery.com/nursery-plants/echinacea-purpurea/,https://www.pinelandsnursery.com/echinacea-purpurea-purple-coneflower-1-pot
"Herbaceous, Perennial",EC,Eupatorium coelestinum,BLUE MISTFLOWER,1.50 - 3,1.50 - 3,Powder Blue,"Aug, Sep, Oct","Full Sun, Part Shade",Medium,FAC,Zone 5 to 10,"Butterflies, Hummingbirds, Pollinators","Clay Soil Tolerant, Deer","Moist loam, sand, or clay.",Blue mistflower is good as a border plant or as a colonizing groundcover. The fluffy-edged flowers are a magnet for late-season butterflies. It also spreads quickly and can become a pest.,Medium,Wood margins; stream banks; low woods; wet meadows; ditches,"Easily grown in average, medium to wet, well-drained soils in full sun to part shade. Prefers moist, fertile, humusy soils which do not dry out. Mistflower is a vigorous plant that spreads aggressively by rhizomes and self-seeding. In some areas of the U.S., the species is considered to be a spreading weed. Propagate by clump division in early spring. Plants will grow in wet areas. Taller plants may be cut back in summer to prevent flopping.",Wild flower garden. Naturalized areas. Periphery of stream of pond. Open woodland garden. May be grown in borders as long as sited in an area where spreading roots will not interfere with other plants.,Use Wildlife: This wildflower attracts bees and butterflies.,,"No serious insect or disease problems. Some susceptibility to powdery mildew. Leaf miners and aphids may also visit. Plants tend to flop and may need support. Spreading tendencies must be watched, particularly if planted in the perennial border.",https://www.missouribotanicalgarden.org/PlantFinder/PlantFinderDetails.aspx?kempercode=j870,https://www.wildflower.org/plants/result.php?id_plant=coco13,https://www.pleasantrunnursery.com/plant-name/Eupatorium-coelestinum,https://newmoonnursery.com/nursery-plants/eupatorium-coelestinum/,https://www.pinelandsnursery.com/conoclinium-coelestinum-blue-mistflower-2-plug
"Herbaceous, Perennial",ED,Eupatorium dubium,"LITTLE JOE PYE WEED, COASTAL PLAIN JOE PYE WEED",3 - 4,1 - 3,,,"Full Sun, Part Shade","Medium, Wet",FACW,Zone 3 to 9,Butterflies,"Deer, Clay Soil, Wet Soil",,,Low,"moist, usually sandy acidic soil of swamps, bogs, marshes, swales","Easily grown in abundantly moist, fertile, humusy soils in full sun to part shade. Also performs well in moist sandy to gravely soils. Soils must not be allowed to dry out. Generally intolerant of shady locations. Plants may be cut to the ground in late winter. Species plants will spread in the landscape by self-seeding. ‘Little Joe’ is a patented plant that will not come true from seed.","Moist areas in borders, cottage gardens, meadows, native plant gardens, wild/naturalized areas, rain gardens or water margins.",,,No serious insect or disease problems. Good resistance to powdery mildew. Leaves may scorch if soils are allowed to dry out.,https://www.missouribotanicalgarden.org/PlantFinder/PlantFinderDetails.aspx?kempercode=b781,https://www.wildflower.org/plants/result.php?id_plant=EUDU6,https://www.pleasantrunnursery.com/plant-name/Eupatorium-dubium-Baby-Joe,https://newmoonnursery.com/nursery-plants/eupatorium-dubium/,https://www.pinelandsnursery.com/eutrochium-dubium-seed
"Herbaceous, Perennial",EM,Eupatorium maculatum,SPOTTED JOE PYE WEED,4 - 7,3 - 4,Purple,"Jun, Jul, Aug, Sep, Oct, Nov",Full Sun,"Medium, Wet",,Zone 4 to 8,Butterflies,"Deer, Clay Soil, Wet Soil",,,Low,,"Easily grown in average, medium to wet soils in full sun. Tolerates some light afternoon shade, particularly in hot summer climates. Prefers moist, fertile, humusy soils which do not dry out. Cut plants to the ground in late winter.","Tall plant for moist soils in borders, cottage gardens, meadows, native plant gardens, wild/naturalized areas or water margins.",,,No serious insect or disease problems. Leaves may scorch if soils are allowed to dry out.,https://www.missouribotanicalgarden.org/PlantFinder/PlantFinderDetails.aspx?taxonid=292659&isprofile=1&basic=eutrochium,https://www.wildflower.org/plants/result.php?id_plant=EUMAB4,https://www.pleasantrunnursery.com/plant-name/Eupatorium-maculatum-Gateway,https://newmoonnursery.com/nursery-plants/eupatorium-maculatum/,https://www.pinelandsnursery.com/eupatorium-maculatum-spotted-joe-pye-weed-2-plug
"Herbaceous, Perennial",EP1,Eupatorium perfoliatum,"COMMON BONESET, AMERICAN BONESET",4 - 6,3 - 4,White,"Jul, Aug, Sep","Full Sun, Part Shade","Medium, Wet",FACW,Zone 3 to 8,Butterflies,"Deer, Clay Soil, Wet Soil",Moist to wet soils,,Low,Damp prairies; alluvial woods; bogs,"Easily grown in average, medium to wet soils in full sun to part shade. Does well in both sandy and clay soils. Needs constant moisture. May flop and requires staking in rich, fertile soils.","Good size and late bloom for borders, native plant gardens, wildflower gardens, cottage gardens, woodland gardens, rain gardens, or banks of ponds or water gardens.","Use Medicinal: The dried leaves have been used to make a tonic, boneset tea, thought effective in treating colds, coughs, and constipation. (Niering)",,No serious insect or disease problems. Foliage may scorch if soils are allowed to dry out.,https://www.missouribotanicalgarden.org/PlantFinder/PlantFinderDetails.aspx?taxonid=277187,https://www.wildflower.org/plants/result.php?id_plant=eupe3,https://www.pleasantrunnursery.com/plant-name/Eupatorium-perfoliatum,https://newmoonnursery.com/nursery-plants/eupatorium-perfoliatum/,https://www.pinelandsnursery.com/eupatorium-perfoliatum-boneset-seed
"Herbaceous, Perennial",EP2,Eupatorium purpureum,PURPLE JOE PYE WEED,5 - 7,2 - 4,,,"Full Sun, Part Shade",Medium,FAC,Zone 4 to 9,Butterflies,"Deer, Clay Soil, Wet Soil",Moist soils,,Low,Moist prairies; wood edges; wooded slopes,"Easily grown in average, medium moisture soils in full sun to part shade. Prefers moist, fertile, humusy soils which do not dry out. Tolerant of clay soils. Cut plants to the ground in late winter. Best propagated by stem cuttings. This species generally grows better in open woodland areas than E. maculatum which generally likes moister soils.","Many people perceive Joe Pye weed to be nothing more than a roadside weed and have never seriously considered its outstanding ornamental attributes. It is a substantial plant which needs space, but when planted in groups or massed can provide spectacular flowering and architectural height. Border rears, cottage gardens, meadows, native plant gardens, wild/naturalized areas or water margins.","Use Wildlife: An important source of honey, attracting pollinators by the score.",,Leaves may scorch if soils are allowed to dry out. Powdery mildew and rust may occur. Deer tend to avoid this plant.,https://www.missouribotanicalgarden.org/PlantFinder/PlantFinderDetails.aspx?kempercode=c740,https://www.wildflower.org/plants/result.php?id_plant=eupu21,,https://newmoonnursery.com/nursery-plants/eupatorium-purpureum/,
"Herbaceous, Perennial",ED1,Eurybia divaricata,WHITE WOOD ASTER,1 - 2.50,1.50 - 2.50,"White, Green, Brown","Aug, Sep, Oct, Nov","Part Shade, Full Shade","Dry, Medium",,Zone 3 to 8,Butterflies,"Drought, Heavy Shade, Dry Soil, Shallow-Rocky Soil","Tolerates dry soil, shade to part shade neutral to slightly acidic conditions.","Vigorous or agressive, even in dry shade.",Low,Woodland,"Easily grown in average, dry to medium, well-drained soil in part shade to full shade. Thrives in shade and tolerates dry conditions. Good air circulation and some morning sun help reduce incidence of foliar diseases. Propagate by division in spring.","Open shade gardens, woodland areas, native plant gardens or cottage gardens.",,,"No serious insect or disease problems. Some susceptibility to powdery mildew. Aster wilt can also be an occasional problem, particularly if plants are grown in poorly-drained clay soils.",https://www.missouribotanicalgarden.org/PlantFinder/PlantFinderDetails.aspx?kempercode=h170,https://www.wildflower.org/plants/result.php?id_plant=EUDI16,,https://newmoonnursery.com/nursery-plants/aster-divaricatus/,https://www.pinelandsnursery.com/eurybia-divaricata-white-wood-aster-seed
"Herbaceous, Perennial",HA,Helenium autumnale,COMMON SNEEZEWEED,3 - 5,2 - 3,Yellow,"Aug, Sep, Oct",Full Sun,"Medium, Wet",FACW,Zone 3 to 8,Butterflies,"Deer, Clay Soil, Wet Soil",Moist clay soils.,Sneezeweed requires a damp site. The typical species occurs in the East. Var. grandiflorum and var. montanum are the common western varieties.,Medium,"Moist, open areas along streams & ponds; wet meadows","Easily grown in average, medium to wet soils in full sun. Prefers rich, moist soils. Intolerant of dry soils. Avoid overfertilization which may cause plants to grow too tall. Although not required, plants may be cut back in early June (at least six weeks before normal flowering) to reduce plant height and to encourage branching, thus leading to a more floriferous bloom, healthier foliage and less need for support. Remove spent flowers to encourage additional bloom. Cut back plants by 1/2 after flowering. Divide clumps as needed (every 3-4 years) to maintain vigor.","Borders. Also effective in prairies, meadows, cottage gardens, wild gardens, naturalized areas or in moist soils along bodies of water.",Use Food: Poisonous to humans.,,"No serious insect or disease problems. Foliage is susceptible to powdery mildew, leaf spot and rust. This species generally requires some staking or other support and will benefit from pinching or July-cutback as detailed above. Deer tend to avoid this plant.",https://www.missouribotanicalgarden.org/plantfinder/plantfinderdetails.aspx?kempercode=c930,https://www.wildflower.org/plants/result.php?id_plant=heau,https://www.pleasantrunnursery.com/plant-name/Sombrero_Sneezeweed,https://newmoonnursery.com/nursery-plants/helenium-autumnale/,https://www.pinelandsnursery.com/helenium-autumnale-sneezeweed-seed
"Herbaceous, Perennial",HH,Heliopsis helianthoides,"SMOOTH OXEYE, OXEYE SUNFLOWER",3 - 6,2 - 4,Yellow,"Jun, Jul, Aug, Sep",flower,"Dry, Medium",UPL,Zone 3 to 9,"Birds, Butterflies","Drought, Erosion, Clay Soil, Dry Soil, Shallow-Rocky Soil, Deer",Sandy soils.,"An undemanding plant which provides excellent, mid-summer color. Eastern plants belong to var.",Low,"Moist to dry, open woodlands; prairies; fields","Easily grown in average, dry to medium, well-drained soil in full sun. Tolerates drought, but does best if regularly watered. Tolerates a wide range of soils, including poor, dry, and clayey. Tolerates some light shade, but plants are less vigorous and stems need support in heavier shade. Remove spent flowers to extend bloom season. Plant stems may be cut back by 1/3 to 1/2 in late May to reduce overall plant height.",Provides long summer bloom for the perennial border or cutting garden. Also effective in a native plant or wild garden or as part of a naturalized planting or prairie area.,,,No serious insect or disease problems. Some susceptibility to aphids. Taller plants may need staking or other support.,https://www.missouribotanicalgarden.org/PlantFinder/PlantFinderDetails.aspx?kempercode=g520,https://www.wildflower.org/plants/result.php?id_plant=HEHE5,https://www.pleasantrunnursery.com/plant-name/Heliopsis-helianthoides,https://newmoonnursery.com/nursery-plants/heliopsis-helianthoides/,https://www.pinelandsnursery.com/heliopsis-helianthoides-false-sunflower-seed
"Herbaceous, Perennial",HM,Hibiscus moscheutos,SWAMP ROSEMALLOW,3 - 7,2 - 4,White,"Jul, Aug, Sep",Full Sun,"Medium, Wet",OBL,Zone 5 to 9,Butterflies,Wet Soil,"Moist to wet, slightly acidic soils.",Clumps of Hibiscus start to grow late in the season and flower over a long period in late summer.,Low,Swampy forests; wet meadows; marshes,"Easily grown in average, medium to wet soils in full sun. Best in moist, organically rich soils, but does surprisingly well in average garden soils as long as those soils are not allowed to dry out. Regular deep watering is advisable. Tolerant of heat and humidity. Tolerates some light shade, but full sun with good air circulation produces the best flowers, the strongest stems and the best environment for resisting potential diseases. Site in locations protected from wind to minimize the risk of wind burn. Pinch back growing tips when they reach 8” and again at 12” if bushy plants are desired. Deadhead individual flowers to maintain plant appearance. Cut back stems to approximately 3-4 inches in late autumn. New growth shoots are slow to emerge in spring. However, once new growth begins, it proceeds quite rapidly. Plants will benefit from regular fertilization during the growing season.",Moist borders. Specimens. Useful in low spots or wet areas in the landscape. Effective along streams or ponds. Temporary summer screen or hedge. Can be grown in large containers.,Use Wildlife: Hummingbirds,,"Some susceptibility to leaf spots, blights, rusts and canker. Japanese beetles can severely damage foliage if left unchecked. Whiteflies, aphids and scale are occasional insect visitors. Leaf scorch will occur if soils are allowed to dry out. Healthy plants grown in the proper environment usually do not need staking.",https://www.missouribotanicalgarden.org/plantfinder/PlantFinderDetails.aspx?taxonid=282590,https://www.wildflower.org/plants/result.php?id_plant=HIMO,https://www.pleasantrunnursery.com/plant-name/Hibiscus-moscheutos,https://newmoonnursery.com/nursery-plants/hibiscus-moscheutos/,https://www.pinelandsnursery.com/hibiscus-moscheutos-swamp-rose-mallow-seed
"Herbaceous, Perennial",IV,Iris versicolor,"BLUE FLAG, BLUE WATER IRIS",2 - 2.50,2 - 2.50,Blue To Purple,"May, Jun","Full Sun, Part Shade","Medium, Wet",OBL,Zone 3 to 9,,"Deer, Wet Soil, Wet Site Tolerant","Moist, rich soils.","Even though it can tolerate complete submergence, this iris can be easily grown in most gardens. It is not a demanding plant. Once established, it will spread by self-seeding and extension of its rhizomes.",Low,Meadows; stream banks; marshes; swamps,"Grow in medium to wet soils in full sun to part shade. This iris may be grown in up to 2-4” of shallow standing water (muddy bottom or containers), or in moist shoreline soils or in constantly moist humusy soils of a border. Propagate by division after bloom. Wear gloves when dividing the rhizomes. After fall frost, plant leaves may be trimmed back to about 1” above the crown. Will naturalize to form colonies in the wild.",Best grouped in sunny areas of ponds or water gardens. Also may be grown in moist border areas.,Use Wildlife: Hummingbirds,,"Susceptible to a number of insect pests including iris borer, iris thrips, and aphids. Potential disease problems include various rots (rhizome rot, crown rot, bacterial soft rot) leaf spot, and leaf/blossom blight. Aphids can spread mosaic virus.",https://www.missouribotanicalgarden.org/PlantFinder/PlantFinderDetails.aspx?taxonid=281141,https://www.wildflower.org/plants/result.php?id_plant=irve2,https://www.pleasantrunnursery.com/plant-name/Iris-versicolor,https://newmoonnursery.com/nursery-plants/iris-versicolor/,https://www.pinelandsnursery.com/iris-versicolor-blue-flag-iris-1-pot
"Herbaceous, Perennial",LS,Liatris spicata,DENSE BLAZING STAR,1.50 - 2.50,0.50 - 1,Purple,"Jun, Jul, Aug, Sep",Full Sun,Medium,FAC,Zone 3 to 8,"Birds, Hummingbirds, Butterflies","Drought, Clay Soil, Deer","Moist, average soils.",,Low,"Moist, wood openings; mesic prairies; marsh edges","Easily grown in average, medium, well-drained soils in full sun. Somewhat tolerant of poor soils, but prefers moist, fertile ones and generally performs better in moist soils than most other species of Liatris . Intolerant of wet soils in winter. Tolerant of summer heat and humidity. May be grown from seed, but is slow to establish.",Excellent compact plant for perennial border fronts or cutting gardens.,Use Wildlife: Butterflies frequent Liatris spp.,,No serious insect or disease problems. Taller plants may require staking or other support. 'Kobold' does not need staking.,https://www.missouribotanicalgarden.org/PlantFinder/PlantFinderDetails.aspx?kempercode=d790,https://www.wildflower.org/plants/result.php?id_plant=lisp,https://www.pleasantrunnursery.com/plant-name/Liatris-spicata,https://newmoonnursery.com/nursery-plants/liatris-spicata/,https://www.pinelandsnursery.com/liatris-spicata-dense-blazingstar-seed
"Herbaceous, Perennial",LS1,Lilium superbum,TURK'S CAP LILY,4 - 7,0.50 - 0.75,,,"Full Sun, Part Shade","Medium, Wet",FACW,Zone 5 to 8,Hummingbirds,Wet Soil,"Loam, Sand. Good drainage essential.",Like moist but well drained soils,Medium,"Wet meadows, swamps, and woods.","Easily grown in average, medium to wet, well-drained soils in full sun to part/filtered sun. Best in consistently moist, humusy soils. Soils should not be allowed to dry out. Mulch helps keep root zone cool. Plant bulbs 5-6"" deep in fall. Bulbs are stoloniferous, and plants often spread to form impressive colonies in the wild. May be slow to spread in cultivation, particularly when sited in less than optimum growing conditions.","Borders, cottage gardens, native plant gardens or meadows. Good plant for moist low spots or pond peripheries. Best grouped or massed.",,,No serious insect or disease problems.,https://www.missouribotanicalgarden.org/PlantFinder/PlantFinderDetails.aspx?kempercode=d880,https://www.wildflower.org/plants/result.php?id_plant=lisu,,,
"Herbaceous, Perennial",LC,Lobelia cardinalis,CARDINAL FLOWER,2 - 4,1 - 2,Red,"Jul, Aug, Sep, Oct","Full Sun, Part Shade","Medium, Wet",FACW,Zone 3 to 9,"Hummingbirds, Butterflies","Rabbit, Deer, Wet Soil","Moist to wet, humus-rich soil. Medium Loam, Clay Loam, Limestone-based, Sandy, Sandy Loam, Clay",Cardinal flower has very showy red blooms. It is particularly attractive at the edge of a woodland garden. The soil must be kept moist or wet at all times. A winter mulching in northern climes is beneficial. It can be propagated by bending a,Low,"Ditches, Ravines, Depressions, Woodlands' edge, Opening, Stream banks, Roadsides, Prairie, Plains, Meadows, Pastures, Savannas, Near lakes or ponds, Swamps","Easily grown in rich, medium to wet soils in full sun to part shade. Needs constant moisture. Tolerates brief flooding. Soils should never be allowed to dry out. Will tolerate full sun in cool, northern climates, but otherwise appreciates part shade. Root mulch should be applied in cold winter climates to protect the root system and to prevent root heaving. Mulch will also help retain soil moisture.","Effective in moist areas of woodland/shade gardens, wet meadows or along streams or ponds. Water gardens. Rain garden. Also adds late summer bloom and height to borders as long as soils are kept uniformly moist.","Use Ornamental: Aromatic, Color, Showy, Garden, Use Wildlife: In bloom, cardinal flower attracts hummingbirds. Nectar-Hummingbirds, Use Medicinal: Amerindians used root tea for stomach aches, syphilis, typhoid, worms. Leaf tea used for colds, croup, nosebleeds, fevers, headaches, rheumatism. Poisonous. (Foster & Duke), Use Other: Used mainly in love potions. Finely chopped roots places in food as love charm.",,No serious insect or disease problems. Snails and slugs may damage the foliage. Some hybrid lobelias have not performed well at the Kemper Center in St. Louis for reasons that at this point are unclear. Foliage contains alkaloids which are very toxic to humans if ingested.,https://www.missouribotanicalgarden.org/PlantFinder/PlantFinderDetails.aspx?kempercode=d940,https://www.wildflower.org/plants/result.php?id_plant=loca2,https://www.pleasantrunnursery.com/plant-name/Lobelia-cardinalis,https://newmoonnursery.com/nursery-plants/lobelia-cardinalis/,https://www.pinelandsnursery.com/lobelia-cardinalis-cardinal-flower-1-pot
"Herbaceous, Perennial",LS2,Lobelia siphilitica,BLUE LOBELIA,2 - 3,1.50 - 2,Blue,"Jul, Aug, Sep, Oct","Full Sun, Part Shade","Medium, Wet",OBL,Zone 5 to 8,"Butterflies, Hummingbirds, Pollinators","Deer, Wet Soil, Black Walnut Tolerant, Wet Site Tolerant","Clay, Loam, Sand","Not at all drought tolerant, keep soil moist, watering if necessary in average soil conditions.",Low,"Open, wet woods; stream banks; marshes; meadows","Best grown in rich, medium to wet soils in full sun to part shade. Needs constant moisture. Tolerates brief flooding. Thrives in bog gardens. Soils should never be allowed to dry out. Tolerates full sun in northern climates, but appreciates part afternoon shade in hot summer climates of the lower Midwest and South. Root mulch should be applied in cold winter climates such as St. Louis to protect the root system and to prevent root heaving. Mulch will also help retain soil moisture. Some of the hybrid cultivars of Lobelia × speciosa can be grown from seed.","Effective in moist areas of woodland/shade gardens, wet meadows or along streams or ponds. Water gardens. Rain garden. Also adds late summer bloom and height to borders as long as soils are kept uniformly moist.",,,No serious insect or disease problems. Snails and slugs may damage the foliage. Some hybrid lobelias have not performed well at the Kemper Center in St. Louis for reasons that at this point are unclear. L . x speciosa hybrids are often short-lived and are sometimes grown as annuals.,https://www.missouribotanicalgarden.org/PlantFinder/PlantFinderDetails.aspx?taxonid=292902,https://www.wildflower.org/plants/result.php?id_plant=losi,https://www.pleasantrunnursery.com/plant-name/Lobelia-siphilitica,https://newmoonnursery.com/nursery-plants/lobelia-siphilitica/,https://www.pinelandsnursery.com/lobelia-siphilitica-blue-lobelia-1-pot
"Herbaceous, Perennial",MR,Mimulus ringens,MONKEY FLOWER,1 - 3,0.75 - 1,Blue,"Jul, Aug, Sep","Full Sun, Part Shade","Medium, Wet",OBL,Zone 3 to 8,"Butterflies, Hummingbirds, Pollinators","Deer, Wet Soil, Clay Soil Tolerant, Wet Site Tolerant",Loam,,Low,Wet meadows and streambanks.,Grow in moist to wet soils in full sun to part shade. Best in part shade. Naturalizes in optimum growing conditions by both self-seeding and creeping rhizomes.,"Best naturalized in moist to wet soils in water gardens, bog gardens, wet meadows, water margins or low spots. May be grown in moist soils in borders as long as soils do not dry out.",,,No serious insect or disease problems.,https://www.missouribotanicalgarden.org/PlantFinder/PlantFinderDetails.aspx?kempercode=z410,https://www.wildflower.org/plants/result.php?id_plant=MIRI,https://www.pleasantrunnursery.com/plant-name/Mimulus-ringens,,https://www.pinelandsnursery.com/mimulus-ringens-allegehney-monkey-flower-seed
